Job title,Company name,Date,Location,Skills,Links,Salary,RequirementsTechnical Software Team Leader,intrazero,21 days ago,"Nasr City, Cairo, Egypt ",Full timeManager · 5+ Yrs of Exp · Information Technology (IT) · Computer Science · Computer Engineering · Software · CSS · javaScript · HTML · Java · Python · PHP,https://wuzzuf.net/jobs/p/BR4W0NxJyrGy-Technical-Software-Team-Leader-intrazero-Cairo-Egypt?o=54&l=sp&t=sj&a=python|search-v3|hpb,"Confidential, Bonus","Bachelor’s degree in any field, preferably with a computer science or engineering background| 5+ years of relevant experience| Good command of English| 5+ years of experience with web development languages : (PHP, Python or Node.js)| 5+ years of experience with JavaScript, CSS, and HTML| +1 years hands-on experience with React, VueJS or Angular is a must.| Strong knowledge of restful API's| Strong knowledge of version control systems (Git, or similar)| Familiarity with Agile development environment and methodologies.| Excellent knowledge of DB concepts and tools (SQL server, MYSQL databases, PostgreSQL)| Excellent knowledge of Linux Server and tools| Excellent knowledge of OOP (concepts, techniques, principles, analysis, and design)| Excellent knowledge of design patterns| Excellent knowledge of data processing and handling various types and sizes of documents and media| Excellent knowledge of ORM| Experience with CI/CD is a plus| Experience with AWS services is a plus| Experience with Docker is plus"
Elixir Developer,Flairstech,25 days ago,"Maadi, Cairo, Egypt ",Full timeEntry Level · 1+ Yrs of Exp · Elixir · PHP · Ruby · C# · OOP · Python · Software Development · Information Technology (IT) · Computer Science · Computer Engineering,https://wuzzuf.net/jobs/p/k33viXg8GAAR-Elixir-Developer-Flairstech-Cairo-Egypt?o=55&l=sp&t=sj&a=python|search-v3|hpb,Confidential,"Since Elixir is relatively new, experience in Elixir is not required.| The technical backgrounds vary covering Python, Ruby, PHP and C#.| We are looking for a hardworking motivated developer who always seizes opportunities to learn and advance."
Process Improvement & Automation Specialist,Confidential -,24 days ago,"Obour City, Cairo, Egypt ",Full timeExperienced · 2 - 5 Yrs of Exp · Process Improvement · Quality Assurance · Quality Control · Computer Science · Artificial Intelligence · Data warehouse · Developing processes · Technologies · Telecom Engineering · Information Technology,https://wuzzuf.net/jobs/p/pFfeCCJSjWfk-Process-Improvement-Automation-Specialist-Cairo-Egypt?o=56&l=sp&t=sj&a=python|search-v3|hpb,"Confidential, Social & Medical Insurance + Transportation.","Bachelor’s degree in computer science.| 2+ years of experience in applying Artificial Intelligence and Data warehouse to practical and comprehensive technology solutions.| Proven experience with ML, deep learning, Python, NLP.| Experience with Project Management, governance, and change enablement.| Knowledge of basic algorithms, object-oriented and functional design principles, and best practice patterns.| Experience with REST API development, NoSQL design, RDBMS design and optimizations.| Experience with innovation accelerators.| Experience with Cloud environments."
Full Stack Developer,Conference Organizing Bureau,26 days ago,"Mohandessin, Giza, Egypt ",Full timePart timeExperienced · 3 - 5 Yrs of Exp · Software Development · Full Stack · Web · Information Technology (IT) · Computer Science · javaScript · PHP · MySQL · React · Python,https://wuzzuf.net/jobs/p/4i7Xa9iwZmoQ-Full-Stack-Developer-Conference-Organizing-Bureau-Giza-Egypt?o=57&l=sp&t=sj&a=python|search-v3|hpb,Confidential,"Proven experience as a full stack dev or similar role| Experience developing complex web-based applications | Knowledge of multiple backend languages e.g. PHP, Python with frameworks such as Zend or Django| Working experience with javascript frameworks such as React and/or Angular| Familiarity with databases e.g. MySQL and/or Postgres and web servers e.g. Apache"
Senior Linux System Engineer,Link Datacenter,24 days ago,"Dokki, Giza, Egypt ",Full timeExperienced · 3 - 5 Yrs of Exp · Engineering · Communication Engineering · Information Technology (IT) · Computer Science · Installation · Maintenance · Solaris · CentOS · RedHat · NGINX,https://wuzzuf.net/jobs/p/JBwKi6ngQgSR-Senior-Linux-System-Engineer-Link-Datacenter-Giza-Egypt?o=58&l=sp&t=sj&a=python|search-v3|hpb,Confidential,"Bachelor degree from a reputable university (Communications engineering or computer science background is preferred).| Minimum “3 to 5” years of experience in NIX Platform (RedHat – CentOS – Ubuntu) is a must.| Managing, maintaining and tuning webservers (NGINX, PHP-FPM and Apache).| Managing DNS Systems (BIND and Power DNS).| MySQL Administration."
Senior C++ Developer,CrossWorkers,28 days ago,"Cairo, Egypt ",Full timeExperienced · 5+ Yrs of Exp · C++ · Information Technology (IT) · Multithreading · Software Engineering · RestcppAPI · Win32 · Python · javaScript · Computer Science · Software Development,https://wuzzuf.net/jobs/p/KzBXRFAvuLQp-Senior-C-Developer-CrossWorkers-Cairo-Egypt?o=59&l=sp&t=sj&a=python|search-v3|hpb,Confidential,"+5 years’ experience with strong C++ programming skills.| Experience with QT and modern C++ is preferred.| Experience with developing portable applications for Windows, macOs and Linux is preferred.| Experience with Python and JavaScript is preferred.| Must have good debugging, problem solving, and communications skills.| BS degree in Computer Science, Computer Engineering or a related discipline."
Senior Back-End Developer - Part Time,Appgain,1 month ago,"Maadi, Cairo, Egypt ",Part timeExperienced · 4 - 6 Yrs of Exp · Python Developer · IT · Flask · RestAPI · CMS · Mongo DB · SQL · NOSQL DB · Python · GIT,https://wuzzuf.net/jobs/p/n7ks8VPtJHXK-Senior-Back-End-Developer---Part-Time-Appgain-Cairo-Egypt?o=60&l=sp&t=sj&a=python|search-v3|hpb,Confidential,"BS or Graduate degree in Computer Science or Engineering | Python Flask, Python Profiling | Expert in CI using Jenkins | Good experience in RestAPI development, Elastic Search, Redis, AWS SQS | Expert in NoSQL DB: Mongo DB | Experienced in the development of Big Data platforms "
Cloud Infrastructure Engineer - Cairo,ExaServe LLC,29 days ago,"Nasr City, Cairo, Egypt ",Full timeExperienced · 3 - 6 Yrs of Exp · Information Technology (IT) · Computer Science · Cloud · Infrastructure · AWS · Azure · Engineering · Networking · Python · Firewall,https://wuzzuf.net/jobs/p/NEtpkAzqYQ2F-Cloud-Infrastructure-Engineer---Cairo-ExaServe-LLC-Cairo-Egypt?o=61&l=sp&t=sj&a=python|search-v3|hpb,Confidential,"Hands on cloud engineer with experience in AWS and AZURE. | AWS Solution Architect Professional or equivalent. | Expert level Cloud Security engineering| SME on Cloud networking, Transit gateway setup, multi-cloud peering| Working knowledge/experience with Terraform and infrastructure as a code| Jenkins & Python are plus| Application Firewall ruleset, distributed security architecture expert and infrastructure audit/Pen testing"
Big Data Engineer,Fawry Banking & Payment Technology Services,1 month ago,"6th of October, Giza, Egypt ",Full timeExperienced · 2+ Yrs of Exp · Information Technology (IT) · Telecom Engineering · Big Data · Big Data Applications · Linux · UNIX · Python · Java · javaScript · Java SE,https://wuzzuf.net/jobs/p/pZ5ffCOBOVAk-Big-Data-Engineer-Fawry-Banking-Payment-Technology-Services-Giza-Egypt?o=62&l=sp&t=sj&a=python|search-v3|hpb,Confidential,"2+ years of experience with the suite of open source big data technologies and platforms (Cloudera/Hortonworks, Hadoop Ecosystems, Spark, Kafka, Hive, Cassandra).| Experience with object-oriented/object function scripting languages: Python, Java, C++, Scala, etc, is a plus.| Basic knowledge of Linux/UNIX including to process large data sets.| Excellent communication skills and a dynamic team player."
Senior PHP Developer - Plugins Development,Paymob Solutions,1 month ago,"Maadi, Cairo, Egypt ",Full timeExperienced · 2+ Yrs of Exp · PHP · Web Development · Software Development · Laravel · Information Technology (IT) · Plugins Development · Computer Science · CSS · javaScript · HTML,https://wuzzuf.net/jobs/p/mnkTg5wWkleo-Senior-PHP-Developer---Plugins-Development-Paymob-Solutions-Cairo-Egypt?o=63&l=sp&t=sj&a=python|search-v3|hpb,"Confidential, Social & Medical Insurance","Experience with Cloud Commerce systems - Magento, Shopify, Bigcommerce, Salesforce commerce cloud, Opencart , Prestashop , WooCommerce and cs-cart .| Knowledge of HTML/HTML5 and CSS/CSS3 with well-grounded JavaScript skills| Advanced knowledge and hands-on experience web technologies and standards (HTML & CSS/DNS/SMTP/API/data transfer protocols and databases)| Working knowledge in modern web development workflows| Deep knowledge of APIs| PHP| MySQL profiling and query optimization| Redis| Deep knowledge in OOP / SOLID principles| JavaScript| VueJS| HTML/CSS| JSON-based REST API| Deep knowledge in OOP / SOLID principles| JavaScript| JQuery| HTML/CSS| MySQL profiling and query optimization"
Senior Odoo Developer,Confidential -,28 days ago,"Victoria, Alexandria, Egypt ",Full timeExperienced · 3 - 5 Yrs of Exp · Information Technology (IT) · Computer Science · Odoo · Python · Software Development · XML · API · Programming · Software · Development,https://wuzzuf.net/jobs/p/CDuzyB9Subo8-Senior-Odoo-Developer-Alexandria-Egypt?o=64&l=sp&t=sj&a=python|search-v3|hpb,Confidential,"Education: BA (prefer computer science and Computer Engineering)| Experience: 3-5 years| Experience in integrating Odoo with Other Business Systems| Strong object-oriented programming |  Proficiency with Agile methodology (Scrum/Kanban) and Software Development Lifecycle |  Experience in BDD (Behavior Driven Development)| Ability to elicit needs from key decision-makers| Familiar with the TFS, Jira | Solid knowledge of REST API/GraphQL and XML RPC | Solid UML diagrams experience is plus| Relevant certificates are plus| Skills: Excellent communication skills, Leadership skills, organizational skills, Time Management."
Odoo Technical Team Leader,Confidential -,28 days ago,"Victoria, Alexandria, Egypt ",Full timeManager · 4 - 6 Yrs of Exp · Computer Science · Information Technology (IT) · Software · Computer Engineering · Software Development · Engineering · Agile · Odoo · API · XML,https://wuzzuf.net/jobs/p/jAfuP3zVZd6g-Odoo-Technical-Team-Leader-Alexandria-Egypt?o=65&l=sp&t=sj&a=python|search-v3|hpb,Confidential,"Education: BA (prefer computer science and Computer Engineering)| Experience: 4-6 years| Experience in integrating Odoo with Other Business Systems| Strong object-oriented programming |  Proficiency with Agile methodology (Scrum/Kanban) and Software Development Lifecycle |  Experience in BDD (Behavior Driven Development)| Ability to elicit needs from key decision-makers| Familiar with the TFS, Jira | Solid knowledge of REST API/GraphQL and XML RPC | Solid UML diagrams experience is plus| Relevant certificates are plus| Skills: Excellent communication skills, Leadership skills, organizational skills, Time Management. Problem solving skills."
Senior PHP Developer - Cairo,Nabd,1 month ago,"Cairo, Egypt ",Full timeExperienced · 2 - 10 Yrs of Exp · PHP · javaScript · MySQL · CSS · HTML · Python · jQuery · Information Technology (IT) · Computer Science · Software Development,https://wuzzuf.net/jobs/p/CJ5KvJyJHy1X-Senior-PHP-Developer---Cairo-Nabd-Cairo-Egypt?o=66&l=sp&t=sj&a=python|search-v3|hpb,Confidential,"Bachelor's degree in technical or business discipline or equivalent experience.| 2+ years of professional experience with rapid web development, using Python, PcHP, HTML, JavaScript, CSS, jQuery, and MySQL.| Experience in planning and delivering software solutions used across multiple products and organizational units.| Extensive knowledge of IT concepts, strategies and methodologies.| Strong oral and written communication skills; presentation skills.| Must be self-starter, proactive and willing to learn and grow with the business."
Odoo Developer,Go2Martket Dynamics,28 days ago,"Sheraton, Cairo, Egypt ",Full timeExperienced · 2 - 5 Yrs of Exp · Computer Science · Odoo · Python · Odoo Development · Odoo Modules · Odoo Developer · Information Technology (IT) · PostgreSQL · HTML · XML,https://wuzzuf.net/jobs/p/dTKB736pZXEQ-Odoo-Developer-Go2Martket-Dynamics-Cairo-Egypt?o=67&l=sp&t=sj&a=python|search-v3|hpb,Confidential,"Experience in integrating Odoo with Other Business Systems.| Should have working knowledge of API's in ODOO.| Experience in writing Modules for Odoo Web site .| Experience in HTML, XML, and JQuery.| Experience in PostgreSQL database.| Experience in Webkit, RML Report, OpenOffice Reports and Pentaho Report (preferred).| Experience in using Eclipse or Pycharm IDEs.| Experience with GITLAB or equivalent source control"
Odoo Developer,Confidential -,29 days ago,"Cairo, Egypt ",Full timeWork from homeEntry Level · 1 - 3 Yrs of Exp · Computer Science · Odoo · Python · Development · Integration · Information Technology (IT) · IT/Software Development · Engineering - Telecom/Technology,https://wuzzuf.net/jobs/p/JxTa6OvIWZGQ-Odoo-Developer-Cairo-Egypt?o=68&l=sp&t=sj&a=python|search-v3|hpb,Confidential,Odoo developer with 1-3 years experience| Work in flexible time| Can make integration with odoo app and other application
Junior Developer,Superior Business Solutions,1 month ago,"Nasr City, Cairo, Egypt ",Full timeEntry Level · 1+ Yrs of Exp · Information Technology (IT) · Computer Science · Software Development · Software Engineering · Programming · Software · C# · Java · PHP · Agile,https://wuzzuf.net/jobs/p/e4fCsUiGx3ZJ-Junior-Developer-Superior-Business-Solutions-Cairo-Egypt?o=69&l=sp&t=sj&a=python|search-v3|hpb,Confidential,"Programming Language such as Node.js, GoLang, python, PHP, Java, C#, jQuery| You are passionate about quality and can engineer it at all stages of software development| You are an expert in practical aspects of running Scrum (or other agile methodologies) within a team and in a distributed cross-team environment.•| Experience +1 year| Fluent English is a MUST| Education: Bachelor's Degree in Computer Science or relevant discipline.| Nice to Have: Previous Experience in Health care.| Residents near Nasr City are preferred| Another foreign language"
Senior Full Stack Developer,Superior Business Solutions,1 month ago,"Nasr City, Cairo, Egypt ",Full timeExperienced · 3+ Yrs of Exp · Information Technology (IT) · Software Development · Computer Science · javaScript · Python · Software · Node.js · English · PHP · C#,https://wuzzuf.net/jobs/p/vuEjfBXqE0kr-Senior-Full-Stack-Developer-Superior-Business-Solutions-Cairo-Egypt?o=70&l=sp&t=sj&a=python|search-v3|hpb,Confidential,"Programming Language such as Node.js, GoLang, python, PHP, Java, C#, jQuery| You are passionate about quality and can engineer it at all stages of software development| You are an expert in practical aspects of running Scrum (or other agile methodologies) within a team and in a distributed cross-team environment.•| Experience More than 3 years| Fluent English is a MUST| Education: Bachelor's Degree in Computer Science or relevant discipline.| Nice to Have: Previous Experience in Health care.| Residents near Nasr City are preferred| Another foreign language"
"Senior Front-End Developer (React, Angular )- Alexandria",Caduceus Lane,29 days ago,"Alexandria, Egypt ",Full timeExperienced · 5+ Yrs of Exp · Java · C++ · C# · HTML · CSS · Python · Information Technology (IT) · Adobe Illustrator · Adobe Indesign · Web Design,https://wuzzuf.net/jobs/p/cRNt6G9wYCIv-Senior-Front-End-Developer-React-Angular---Alexandria-Caduceus-Lane-Alexandria-Egypt?o=71&l=sp&t=sj&a=python|search-v3|hpb,Confidential,"A Bachelor’s degree or relevant academic experience from an accredited university in Computer Information Technology, Computer Science, technology-related field to include coursework in web-based platforms and applications programming using high-level computer programming languages and developmental tools.| 5+ years of experience designing, developing, testing, implementing and maintaining web-based applications systems (with special attention to HTML) including applications and programs using high level generally accepted computer program languages.| Good working knowledge of HTML5, CSS, Jquery, & JavaScript is highly desirable.| Good working knowledge of database design principles and experience with using a database in a web-based environment.| Develops new applications from beginning to end and maintains existing applications.| Ability to work on complex problems where independent action and a high degree of initiative are required.| Exercises considerable judgment within broadly defined practices and procedures to select methods, processes, and techniques for designing tools and delivering information."
Senior Computer Vision Engineer (Machine Learning),Confidential -,1 month ago,"Nasr City, Cairo, Egypt ",Full timeExperienced · 4+ Yrs of Exp · Mobile Image Processing · Computer Science · OpenCV · OpenGL · Bitbucket · Robust · PRD · Objective-C · Image Processing · C++,https://wuzzuf.net/jobs/p/OcFiE8DdCYPc-Senior-Computer-Vision-Engineer-Machine-Learning-Cairo-Egypt?o=72&l=sp&t=sj&a=python|search-v3|hpb,"Confidential, Attractive Package, Medical Insurance With Best Benefits In The Market.","Strong coding with Python/C++; with at least 4 years of experience.| Hands-on experience in Computer Vision and Machine Learning| Experience with deep learning frameworks (Tensorflow, Keras, PyTorch, MXNet, etc.)| Deep Learning implementation expertise (MxNet, TensorFlow, PyTorch, etc.)| Experience in real-time video analytics pipeline is a plus| Hands-on experience in Computer Vision  and/or GPU programming is a plus| Excellent problem-solving ability| Self-motivated and positive personality| Ability to conduct applied research independently| Strong verbal and written communication skills in English| MSc or Ph.D. in a relevant field (e.g. Computer Science, Machine Learning, Applied Mathematics, Engineering"
Full Stack Web Developer,White Corp.,1 month ago,"Maadi, Cairo, Egypt ",Full timeExperienced · 3 - 5 Yrs of Exp · Information Technology (IT) · Full Stack · Software Development · Computer Science · Javascript · CSS · HTML · XML · JQuery · MySQL,https://wuzzuf.net/jobs/p/tbtYwqUn09Zi-Full-Stack-Web-Developer-White-Corp-Cairo-Egypt?o=73&l=sp&t=sj&a=python|search-v3|hpb,Confidential,"3-5 years of proven experience as a Full Stack Developer or similar role.| Knowledge of multiple front-end languages and libraries (e.g. HTML/ CSS, JavaScript, XML, jQuery).| Knowledge of one of the back-end languages (e.g. C#, Java, Python) and JavaScript frameworks (e.g. Angular, React, Node.js).| Familiarity with databases (e.g. MySQL, MongoDB), web servers (e.g. Apache) and UI/UX design.| Experience in the whole deployment cycle of web/back end apps.| Familiarity with source control tools such as Git.| CI/CD experience is a big plus.| Excellent communication and teamwork skills.| Great attention to detail| Organizational skills| An analytical mind| Self-managed person.| Degree in Computer Science, Statistics or relevant field."
DevOps Engineer,Nabd,1 month ago,"Cairo, Egypt ",Full timeExperienced · 2+ Yrs of Exp · DevOps · AWS · Linux · SQL · Java · Python · Software · Information Technology (IT) · Computer Science · Software Development,https://wuzzuf.net/jobs/p/pUrA5rZBUOXu-DevOps-Engineer-Nabd-Cairo-Egypt?o=74&l=sp&t=sj&a=python|search-v3|hpb,Confidential,"B.Sc. in Computer Science or other equivalent technical discipline| AWS: 2+ years’ experience with using a broad range of AWS technologies (e.g. EC2, RDS, ELB, EBD, S3, VPC, Glacier, IAM, CloudWatch, KMS) to develop and maintain an Amazon AWS based cloud solution, with an emphasis on best practice cloud security| DevOps: Solid experience as a DevOps Engineer in a 24x7 uptime Amazon AWS environment, including automation experience with conﬁguration management tools| Scripting Skills: Strong scripting (e.g. Python) and automation skills| Operating Systems: Windows and Linux system administration| Monitoring Tools: Experience with system monitoring tools (e.g. Nagios)| Problem Solving: Ability to analyze and resolve complex infrastructure resource and application deployment issues| OO Programming Skills: Strong OO Programming skills (Java or C#)| DB Skills: Basic DB administration experience (Oracle, SQL Server)| Agile Methodologies: Experience with Agile software development, project management methodologies| Version Control: Experience administrating version control systems such as SVN| Networking: Understanding network topologies and common network protocols and services (DNS, HTTP(S), SSH, FTP, SMTP)"
Senior Full Stack Developer (PHP Laravel & Vue.js),CrossWorkers,1 month ago,"New Cairo, Cairo, Egypt ",Full timeExperienced · 3+ Yrs of Exp · Information Technology (IT) · Software Development · Laravel · VueJs · AJAX · MySQL · javaScript · PHP Laravel · PHP · Computer Science,https://wuzzuf.net/jobs/p/AEBwltYpwd52-Senior-Full-Stack-Developer-PHP-Laravel-Vuejs-CrossWorkers-Cairo-Egypt?o=75&l=sp&t=sj&a=python|search-v3|hpb,"Confidential, Medical & Social Insurance, Transportation.",Bachelors in Software Engineer or Computer Science.| Overall experience 3+ years.| A minimum of 6 months – 2 Years of experience in related field/needed technology.| Culturally fitting with the company’s standards and profile.| Adapting to dynamic work environment.| Possess general programming skills & software development fundamentals. 
Programming Instructor,Kidora,1 month ago,"6th of October, Giza, Egypt ",Freelance / ProjectExperienced · 5 - 10 Yrs of Exp · Programming · Computer Science · Education · Instructor · Online Curriculum · Python · Full Stack · C++ · C · IT/Software Development,https://wuzzuf.net/jobs/p/7QjOGAniCnaW-Programming-Instructor-Kidora-Giza-Egypt?o=76&l=sp&t=sj&a=python|search-v3|hpb,100 to 150 EGP per hour,5+ years using the language  | Previous instructor experience is preferred
Linux Administrator - (Remote),ServerHub,1 month ago,"Dallas, United States ",Full timeWork from homeExperienced · 3+ Yrs of Exp · Linux · AWS · Python · Docker · XEN · KVM · DNS · PaaS · Ruby · Cloud Computing,https://wuzzuf.net/jobs/p/tc9QE9hjNIs6-Linux-Administrator---Remote-ServerHub-Dallas-United-States?o=77&l=sp&t=sj&a=python|search-v3|hpb,Confidential,"Linux 3+ years| Windows 2+ years| Deep understanding of OSI model| Internet protocols ( dhcp, dns, http, smtp etc )Strong background with technology and Linux systems | Experience with IP networking, VPNs, DNS, load balancing and firewalling concept| Experience with Cloud Virtualization technologies such as KVM, Xen, etc| Install, configure, automate, and monitor various Cloud Services (IaaS, PaaS, and SaaS).| Hands-on experience with other cloud-hosted solutions, eg. AWS, Google Compute, Azure, DigitalOcean| Proficiency with configuration management tools such as Ansible, Chef, Puppet, Salt, etc."
Full Stack Developer,Broadnet,1 month ago,"New Cairo, Cairo, Egypt ",Full timeExperienced · 2+ Yrs of Exp · Information Technology (IT) · Computer Science · Software · Software Engineering · Software Development · Web Development · Web Design · Design · HTML · CSS,https://wuzzuf.net/jobs/p/DdeUKlNW0fD7-Full-Stack-Developer-Broadnet-Cairo-Egypt?o=78&l=sp&t=sj&a=python|search-v3|hpb,Confidential,Attention to detail| Creativity| Analysis| Teamwork| Problem solving| Delivering presentations| Ability to teach yourself new technical skills| STRONG communication skills.
ERPNext Developer,Ctopya,1 month ago,"Cairo, Egypt ",Full timeEntry Level · 1+ Yrs of Exp · Python · ERPNext · Information Technology (IT) · JavaScript · Computer Science · Frappè · Node.js · Redis · MariaDB · HTML,https://wuzzuf.net/jobs/p/kQVCrK1tfbw4-ERPNext-Developer-Ctopya-Cairo-Egypt?o=79&l=sp&t=sj&a=python|search-v3|hpb,Confidential,"Operating System: Linux| Languages and tools: Python, Javascript, HTML, CSS, Bootstrap, jQuery, Jinja| Technologies / Frameworks: Frappè, Node.js, Redis, MariaDB| Version control: Git"
Sr.DevOps Engineer,Ctopya,1 month ago,"Cairo, Egypt ",Full timeExperienced · 2+ Yrs of Exp · Computer Science · DevOps · Information Technology (IT) · Software Development · AWS · Ci/CD · SDLC · Software · Python · Azure,https://wuzzuf.net/jobs/p/IJzDgGOvJlzu-SrDevOps-Engineer-Ctopya-Cairo-Egypt?o=80&l=sp&t=sj&a=python|search-v3|hpb,Confidential,"Understands the Software Development Life Cycle (SDLC).| Has a solid grasp of different automation testing tools for developing continuous integration and continuous delivery (CI/CD) pipelines.| Can successfully manage the entire DevOps team.| Proficient experience with CI/CD tools. : Creating and maintaining Pipelines with automated testing and pushing| Proficient knowledge of version control and git tools.| Proficient Experience with bash scripting/troubleshooting.| Proficient Knowledge of 3+ programming languages (PHP, Java and Python).| Proficiency in cloud computing services (AWS, Azure and Similar).| Expert-level Infrastructure Management skills and Virtualization. (Hypervisors ...etc.)| Proficiency in automation tools.        "
